{
  "activation": "inert",
  "catalog_version": "0.1.0",
  "content_sha256": "9fcd34fc8201ab6fde376567be8e3f2cc1f3d65a4823c31867cba789ffe195e2",
  "count": 12,
  "expected_count": 12,
  "kind": "loadout_catalog",
  "lifecycle_state": "inert",
  "records": [
    {
      "activation": "inert",
      "asset_id": "loadout.admin-ops.executive",
      "budget_ceiling": "coordination_default",
      "capability_refs": [],
      "compatibility": "orchestrator>=0.1.0",
      "content_sha256": "cdc198daf60b6eb3cba9c4882d7a30f3674ef234916ae7543a7533287a615d9e",
      "department": "admin-ops",
      "effect_ceiling": "read_heavy_coordination",
      "executable": false,
      "forbidden": [
        "deep_implementation",
        "self_review",
        "merge_deploy",
        "waiver_via_mcp"
      ],
      "kind": "loadout",
      "lifecycle_state": "inert",
      "loadout_id": "loadout.admin-ops.executive",
      "mcp_lane_refs": [
        "mcp.lane.workflow-control",
        "mcp.lane.delegation-coordination",
        "mcp.lane.evidence-governance",
        "mcp.lane.context-assets"
      ],
      "notes": "Inert positional loadout design; native enforcement is R3.",
      "owner": "platform.orchestrator",
      "position": "executive",
      "precedence_inputs": [
        "engine_safety_floor",
        "handbook_version",
        "installation_policy",
        "orchestrator_base",
        "department",
        "hierarchy_layer",
        "position",
        "project_repo_extension",
        "task_class",
        "explicit_task_grant"
      ],
      "provenance": "r1-design-contract",
      "script_refs": [
        "script.generic.repository_health",
        "script.generic.git_diff_summary"
      ],
      "sensitivity": "public",
      "skill_refs": [
        "skill.session-orientation",
        "skill.design-first-gate",
        "skill.investigation-report",
        "skill.handoff-contract",
        "skill.trust-but-verify",
        "skill.orchestrator-admin-ops-exec",
        "skill.task-decomposition",
        "skill.loadout-selection",
        "skill.conference-facilitation",
        "skill.governance-audit",
        "skill.anomaly-handling"
      ],
      "source": "agentic/catalogs/loadouts.json",
      "version": "0.1.0"
    },
    {
      "activation": "inert",
      "asset_id": "loadout.admin-ops.manager",
      "budget_ceiling": "coordination_default",
      "capability_refs": [],
      "compatibility": "orchestrator>=0.1.0",
      "content_sha256": "0957e2b867b0d12f2309b653de32a0fb003bb74fdeb1a57ee3bbada796b733f1",
      "department": "admin-ops",
      "effect_ceiling": "coordination_limited",
      "executable": false,
      "forbidden": [
        "implementation_binding",
        "upward_authority",
        "founder_ops"
      ],
      "kind": "loadout",
      "lifecycle_state": "inert",
      "loadout_id": "loadout.admin-ops.manager",
      "mcp_lane_refs": [
        "mcp.lane.delegation-coordination",
        "mcp.lane.evidence-governance",
        "mcp.lane.context-assets",
        "mcp.lane.workflow-control"
      ],
      "notes": "Inert positional loadout design; native enforcement is R3.",
      "owner": "platform.orchestrator",
      "position": "manager",
      "precedence_inputs": [
        "engine_safety_floor",
        "handbook_version",
        "installation_policy",
        "orchestrator_base",
        "department",
        "hierarchy_layer",
        "position",
        "project_repo_extension",
        "task_class",
        "explicit_task_grant"
      ],
      "provenance": "r1-design-contract",
      "script_refs": [
        "script.generic.repository_health"
      ],
      "sensitivity": "public",
      "skill_refs": [
        "skill.session-orientation",
        "skill.design-first-gate",
        "skill.investigation-report",
        "skill.handoff-contract",
        "skill.trust-but-verify",
        "skill.task-decomposition",
        "skill.dependency-planning",
        "skill.report-acceptance",
        "skill.loadout-selection",
        "skill.conference-facilitation"
      ],
      "source": "agentic/catalogs/loadouts.json",
      "version": "0.1.0"
    },
    {
      "activation": "inert",
      "asset_id": "loadout.admin-ops.supervisor",
      "budget_ceiling": "supervision_default",
      "capability_refs": [],
      "compatibility": "orchestrator>=0.1.0",
      "content_sha256": "d8082a1d019ceec0bb21033fc24435fd06f3703e18f264c27ef4418bc1fff1b8",
      "department": "admin-ops",
      "effect_ceiling": "supervision",
      "executable": false,
      "forbidden": [
        "implementation",
        "waiver",
        "schedule_activation"
      ],
      "kind": "loadout",
      "lifecycle_state": "inert",
      "loadout_id": "loadout.admin-ops.supervisor",
      "mcp_lane_refs": [
        "mcp.lane.workflow-control",
        "mcp.lane.evidence-governance",
        "mcp.lane.context-assets",
        "mcp.lane.maintenance"
      ],
      "notes": "Inert positional loadout design; native enforcement is R3.",
      "owner": "platform.orchestrator",
      "position": "supervisor",
      "precedence_inputs": [
        "engine_safety_floor",
        "handbook_version",
        "installation_policy",
        "orchestrator_base",
        "department",
        "hierarchy_layer",
        "position",
        "project_repo_extension",
        "task_class",
        "explicit_task_grant"
      ],
      "provenance": "r1-design-contract",
      "script_refs": [
        "script.generic.repository_health",
        "script.generic.queue_worker_heartbeat_health"
      ],
      "sensitivity": "public",
      "skill_refs": [
        "skill.session-orientation",
        "skill.design-first-gate",
        "skill.investigation-report",
        "skill.handoff-contract",
        "skill.trust-but-verify",
        "skill.execution-supervision",
        "skill.report-acceptance",
        "skill.recovery-triage",
        "skill.anomaly-handling",
        "skill.ci-test-triage"
      ],
      "source": "agentic/catalogs/loadouts.json",
      "version": "0.1.0"
    },
    {
      "activation": "inert",
      "asset_id": "loadout.admin-ops.worker",
      "budget_ceiling": "worker_default",
      "capability_refs": [],
      "compatibility": "orchestrator>=0.1.0",
      "content_sha256": "4f40e0ec81fc2f023f86c1d8ad55871ebcfa30d31660a3f0d4cad4dffa6c1152",
      "department": "admin-ops",
      "effect_ceiling": "assigned_read_or_evidence",
      "executable": false,
      "forbidden": [
        "implementation_code_writes",
        "review_of_own_work",
        "founder_ops"
      ],
      "kind": "loadout",
      "lifecycle_state": "inert",
      "loadout_id": "loadout.admin-ops.worker",
      "mcp_lane_refs": [
        "mcp.lane.context-assets",
        "mcp.lane.evidence-governance",
        "mcp.lane.maintenance"
      ],
      "notes": "Inert positional loadout design; native enforcement is R3.",
      "owner": "platform.orchestrator",
      "position": "worker",
      "precedence_inputs": [
        "engine_safety_floor",
        "handbook_version",
        "installation_policy",
        "orchestrator_base",
        "department",
        "hierarchy_layer",
        "position",
        "project_repo_extension",
        "task_class",
        "explicit_task_grant"
      ],
      "provenance": "r1-design-contract",
      "script_refs": [
        "script.generic.documentation_link_sweep",
        "script.generic.documentation_metadata_sweep"
      ],
      "sensitivity": "public",
      "skill_refs": [
        "skill.session-orientation",
        "skill.design-first-gate",
        "skill.investigation-report",
        "skill.handoff-contract",
        "skill.trust-but-verify",
        "skill.task-execution",
        "skill.documentation-maintenance",
        "skill.conference-facilitation",
        "skill.schedule-operations",
        "skill.cpprd-changelog-authoring"
      ],
      "source": "agentic/catalogs/loadouts.json",
      "version": "0.1.0"
    },
    {
      "activation": "inert",
      "asset_id": "loadout.qa.executive",
      "budget_ceiling": "coordination_default",
      "capability_refs": [],
      "compatibility": "orchestrator>=0.1.0",
      "content_sha256": "5c1c216cb9b869622942e0f3b4673bddb8c8b9b4dadbcf70ef279fa2c8b0b810",
      "department": "qa",
      "effect_ceiling": "review_coordination",
      "executable": false,
      "forbidden": [
        "implementation",
        "reuse_implementation_context_for_review_or_merge"
      ],
      "kind": "loadout",
      "lifecycle_state": "inert",
      "loadout_id": "loadout.qa.executive",
      "mcp_lane_refs": [
        "mcp.lane.evidence-governance",
        "mcp.lane.delegation-coordination",
        "mcp.lane.context-assets",
        "mcp.lane.workflow-control"
      ],
      "notes": "Inert positional loadout design; native enforcement is R3.",
      "owner": "platform.orchestrator",
      "position": "executive",
      "precedence_inputs": [
        "engine_safety_floor",
        "handbook_version",
        "installation_policy",
        "orchestrator_base",
        "department",
        "hierarchy_layer",
        "position",
        "project_repo_extension",
        "task_class",
        "explicit_task_grant"
      ],
      "provenance": "r1-design-contract",
      "script_refs": [
        "script.generic.repository_health"
      ],
      "sensitivity": "public",
      "skill_refs": [
        "skill.session-orientation",
        "skill.design-first-gate",
        "skill.investigation-report",
        "skill.handoff-contract",
        "skill.trust-but-verify",
        "skill.orchestrator-admin-qa-exec",
        "skill.review-gate",
        "skill.governance-audit",
        "skill.loadout-selection",
        "skill.anomaly-handling"
      ],
      "source": "agentic/catalogs/loadouts.json",
      "version": "0.1.0"
    },
    {
      "activation": "inert",
      "asset_id": "loadout.qa.manager",
      "budget_ceiling": "coordination_default",